company,date,title,link,description
삼성물산,2026-04-21,"한국수자원공사, 삼성물산과 MOU…'공공-민간 협력'으로 해외 물 시장 공...",https://www.cstimes.com/news/articleView.html?idxno=702658,컨슈머타임스=안우진 기자 | 한국수자원공사(K-water)와 삼성물산 건설부문이 국내 물산업의 글로벌 경쟁력을 강화하고 해외 수주 실적을 극대화하기 위해 전략적 파트너십을 구축했다. 양 기관은 지난 17일 서울 강동구... 
삼성물산,2026-04-20,"[공시분석] 삼성물산, UAE HVDC 계약금액 또 증액…'미확정 리스크?'",https://news.ifm.kr/news/articleView.html?idxno=469338,삼성물산이 UAE 고압직류송전(HVDC) 공사 계약금액을 다시 늘려 공시했습니다. 지난해 12월 정정 공시... 해당 사업은 2021년 12월 수주한 UAE 전력 인프라 프로젝트로 전력 변환소(컨버터)와 변전소 공급·설치... 
삼성물산,2026-04-17,"[단독] 삼성물산, 스웨덴서 SMR 공급망 행사 개최",https://www.theguru.co.kr/news/article.html?no=100680,10기를 건설할 계획이다. 이와 함께 SMR 개발도 추진 중이다. 스웨덴의 경우 마이크로소프트와 아마존 등 글로벌 빅테크들이 진출하면서 SMR 수요가 늘었다. 삼성물산과 소형모듈원전(SMR) 개발사 'GE 버노바 히타치... 
삼성물산,2026-04-15,"전쟁에 가로막힌 K-건설, 현대건설 해외수주 97%↓...삼성물산 홀로 33%↑",http://www.consumernews.co.kr/news/articleView.html?idxno=754041,삼성물산의 1분기 수주액은 2억8817만 달러로 32.7% 증가했다. 1분기 수주액도 10대 건설사 중 가장 많다. 삼성물산의 중동 사업지는 UAE 원전과 카타르 LNG 수출기지 탱크 등이 대표적이다. 중동 포트폴리오가 사우디 한... 
삼성물산,2026-04-15,"삼성물산, 신반포 19차·25차 재건축 입찰서 필수 서류 누락으로 논란 확...",https://www.jeonmae.co.kr/news/articleView.html?idxno=1248658,"한편, 신반포 19차·25차 재건축 조합은 포스코이앤씨와 삼성물산의 입찰 참여로 유효 경쟁이 성립됨에 따라, 당초 예상된 일정에 맞춰 오는 5월 30일 시공사 선정 총회를 개최할 예정이다. 서류 누락 사태가 이번 수주전에... "
삼성물산,2026-04-15,"[피벗 인사이트] 삼성물산, 히타치와 '에너지 동맹' 강화…수익 구조 다...",http://www.dailypop.kr/news/articleView.html?idxno=98052,"이런 가운데 삼성물산은 2026년 전체 수주 목표를 전년 대비 약 20% 증가한 23조5000만원으로 설정했다. 이 중 전력망, 원전, 수소 등을 포함한 EPC(설계·조달·시공) 수주 목표는 10조1000만원에 달한다. 이는 2025년... "
삼성물산,2026-04-15,"래미안에 들어갈 'AI 주치의'…삼성물산, 강북삼성병원과 맞손",https://view.asiae.co.kr/article/2026041510064173487,삼성물산은 최근 서울 종로구 강북삼성병원에서 '웰니스 및 홈 헬스케어 상품·서비스 개발을 위한 공동연구 업무협약(MOU)'을 체결했다고 15일 밝혔다. 이번 협약으로 삼성물산은 강북삼성병원의 '만성질환 예측 AI... 
삼성E&A,2026-04-16,"[건설업, 주택 넘어 에너지로] ① 중동 재건 최고 수혜는 '삼성E&A'",http://www.opinionnews.co.kr/news/articleView.html?idxno=136871,삼성E&A의 UAE ADNOC 가스 프로세싱 플랜트. 사진 제공=삼성E&A 건설사들이 해외 에너지 인프라를 중심으로 사업 구조를 재편하고 있다. 국내 주택 설계·시공에서 벗어나 글로벌 원전·가스·LNG(액화천연가스) 설비... 
삼성E&A,2026-04-15,"삼성E&A, 중동 플랜트 재건 호재 기대...안전·외교 변수는 부담",https://www.newspim.com/news/view/20260414001022,"이란 전쟁 이후 중동 지역 재건 기대감이 확대되면서 삼성E&A를 향한 시장의 관심도 높아지고 있다. 삼성E&A가 중동 플랜트 분야에서 축적해온 공사 실적과 수행 경험을 감안할 때, 향후 재건 사업이 본격화될 경우 수주... "
대우건설,2026-04-22,"대우건설, 체코 넘어 원전 영토 넓힌다…SMR부터 원전해체까지 전주기 ...",https://www.theguru.co.kr/news/article.html?no=100895,"베트남·사우디 등 신시장 정조준 조직 개편 통해 실행력 향상 대우건설이 체코 신규 원전 수주를 발판 삼아 글로벌 원전 영토를 넓히고 있다. 단순 시공을 넘어 설계와 유지·보수, 해체까지 아우르는 ‘원전 전주기... "
대우건설,2026-04-21,"대우건설, 신흥3구역 공공참여 재개발 수주 공시",https://www.arunews.com/news/articleView.html?idxno=61790,"대우건설이 경기 성남시 신흥3구역 공공참여 재개발사업을 수주했다고 지난 16일 공시했다. 계약금액은 1조2,686억5,670만원으로 최근 매출액 대비 15.75%에 해당하는 금액이다. 계약기간은 철거공사 착공일로부터... "
대우건설,2026-04-21,[건설사 원전 드라이브] [대우건설] 글로벌인프라본부 신설…'팀코리아...,https://dealsite.co.kr/articles/160207,체코 발판 삼아 미국·베트남 확장…2030년 원전 매출 본격화 기대 대우건설이 체코 원전을 발판으로 '팀코리아' 원전 프로젝트의 핵심 시공사로 부상하며 존재감을 키우고 있다. 대우건설은 원전 사업을 중장기 성장... 
대우건설,2026-04-21,"대우건설, 4000억 의왕·원주 공공임대 수주 ‘청신호’...LH 공공임대사...",https://www.smarttoday.co.kr/ko-kr/articles/106721,|스마트투데이=이재수 기자| 대우건설이 약 4000억 원 규모의 공공지원민간임대주택 사업 우선협상대상자로 선정되며 수주에 청신호를 밝혔다. 대우건설은 20일 한국토지주택공사(LH)로부터 ‘의왕초평 A1’과... 
대우건설,2026-04-21,"대우건설, 직주근접 신흥 주거단지 ‘청주 푸르지오 씨엘리체’ 1351가구...",http://www.fnnews.com/news/202604210931157236,대우건설이 충북 청주 서원구 분평동 일원 분평·미평지구 도시개발사업지 내에 1351가구 규모의 신규 분양 아파트 '청주 푸르지오 씨엘리체'를 공급하며 본격적인 청약 일정에 돌입한다. 단지는 지하 2층에서 지상... 
대우건설,2026-04-20,"대우건설의 승부수, 대장홍대선 철수 후 기업 명운 걸고 올인한 '이것'",https://realty.chosun.com/site/data/html_dir/2026/04/17/2026041702679.html,"대우건설, 대장홍대선 사업 결국 철수 가덕도 신공항 등 대형 사업에 전사 역량 집중 데이터센터·원전 등 고부가가치 신사업 비중 확대 [땅집고] 대우건설이 ‘수주 물량 확보’에 집중하는 건설업계의 오랜 관행을 깨고... "
대우건설,2026-04-20,"대우건설 다시 커지는 해외 대형원전 수주 기대감, 정원주에 베트남은 ...",https://www.businesspost.co.kr/BP?command=article_view&num=436077,대우건설이 체코에 이어 베트남에서 대형원전 건설사업 참여에 고삐를 죌 것으로 보인다. 베트남은 정원주 대우건설 회장이 오랜 기간 공을 들여온 국가로 하노이 스타레이크시티 신도시개발 등 사업 확대에 기회를... 
대우건설,2026-04-17,"대우건설, 일본 EPC 협력 재정비…""LNG 이어 플랜트까지 넓힌다""",https://www.seoultimes.news/news/article.html?no=2000095170,토요·치요다·JGC와 협업 강화…공동 수주 기반 확대 비료·암모니아 등으로 사업 영역 넓혀 중동 복구·동남아 시장 겨냥…해외 사업 다변화 [서울타임즈뉴스 = 허성미 기자] 대우건설이 일본 주요 EPC 기업들과의 협력... 
대우건설,2026-04-17,글로벌 플랜트 수주전 '동맹 전략' 강화…대우건설 등 단독 경쟁에서 협...,https://www.greened.kr/news/articleView.html?idxno=339458,"단순 교류를 넘어 수주 전략 차원의 접근이라는 점에서 의미가 있다. ▲ 대우건설이 토요엔지니어링과 MOU 체결 후 기념사진을 촬영하고 있다. (사진 왼쪽 토요엔지니어링 대표이사 에이지 호소이, 오른쪽 대우건설... "
대우건설,2026-04-17,대우건설 대표 김보현 일본 출장 5박6일 : 도쿄-치바현-가나가와현에서...,https://www.huffingtonpost.kr/article/256707,"대우건설은 김우중 회장 때부터 해외 사업장을 직접 찾아 수주 물꼬를 트는 방식을 이어와, 지금까지 전 세계 481곳에서 해외 공사 실적을 쌓았다. 대우건설은 김보현 사장 및 주요 경영진이 12일부터 17일까지 일본을... "
GS건설,2026-04-22,[단독] 용인 수지 삼성4차 재건축 GS건설 수주 '유력',https://www.asiatime.co.kr/article/20260422500249,2차 시공사 선정 입찰에 GS건설만 참여 경기 용인시 수지 삼성4차아파트 재건축 사업에 GS건설이 깃발을 꽂을 것으로 예상된다. GS건설 자이 BI.(사진=GS건설) 23일 도시정비업계에 따르면 수지 삼성4차아파트가 재건축... 
GS건설,2026-04-22,"일회성 비용 부담 떨친 GS건설, 1Q 영업익 개선 기대…""원전도 넘본다""",https://news.einfomax.co.kr/news/articleView.html?idxno=4410934,베트남 닌투언 2호 원전 수주 여부 등에 관심 GS건설[006360]이 일회성 비용의 부담을 떨치고 올해 1분기 영업이익 개선을 신고할 것으로 기대됐다. 여타 건설사처럼 원전 사업 수주에 대한 기대가 커지고 있다는 점도... 
GS건설,2026-04-21,'80조 시장' 정비사업 각축전…'압구정' 현대건설·'성수' GS건설 약진,https://www.sidae.com/article/2026042114441192483,GS건설도 경쟁입찰 대신 수의계약 중심으로 선별 수주에 나서 올해 서울에서 공사비 약 5조원의 수주를 눈앞에 두고 있다. 강북 최대 정비사업 성수전략정비구역 제1지구 재개발은 GS건설이 단독 입찰해 수의계약을... 
GS건설,2026-04-21,"GS건설, 글로벌 파트너십 다각화로 친환경 신사업 박차",https://www.viva100.com/article/20260421500293,GS건설이 인도 신재생에너지 전력공급 사업 진출과 함께 미국 스타트업과의 무탄소 발전 합작투자를 연이어 추진하며 친환경 에너지 사업 포트폴리오 확장에 나선다. GS건설은 지난 20일 인도 재생에너지 기업 아리... 
GS건설,2026-04-20,"GS건설, 서초진흥 58층 재건축 심의 통과…‘서초자이 컬리너스’ 청사...",https://www.ddaily.co.kr/page/view/2026042015000457965,업계에서는 이번 심의 통과를 계기로 서초권 재건축 수주전도 한층 달아오를 것으로 보고 있다. GS건설이 특히 강조한 부분은 58층 초고층 건물의 구조 안전성이다. 회사는 제2롯데타워를 비롯한 글로벌 마천루 구조... 
GS건설,2026-04-20,"'안전경영 행보'···김태진 GS건설 사장, 대구·경북 현장 방문",http://www.enewstoday.co.kr/news/articleView.html?idxno=2421043,"GS건설은 김태진 GS건설 사장이 대표이사 취임 이후 첫 안전경영 행보로, 지난 16 ~ 17일 양일간 대구... 착공 초기 단계부터 일반 및 기술 안전사항 검토를 강화한다. 이후 주기적인 내부심사 및 점검을 확대해 현장 간... "
GS건설,2026-04-19,"GS건설, 2293가구 대단지…대전 서남부권 대표하는 매머드급 주거타운",https://www.mk.co.kr/article/12021057,도안자이 센텀리체 GS건설이 대전광역시 유성구 용계동 267-3 일원에 들어서는 '도안자이 센텀리체'의 본격적인 분양 일정에 돌입했다. 이번 공급은 대전의 주거 중심축으로 평가받는 도안신도시 2단계 개발이 마무리... 
GS건설,2026-04-18,DL이앤씨·GS건설 컨소시엄 등 분양·청약 ‘동시 진행’,http://www.fntimes.com/html/view.php?ud=202604180047134790048b718333_18,"DL이앤씨를 비롯해 GS건설·SK에코플랜트와 LH가 서울과 수도권, 지방 주요 지역에서 분양과 청약, 준공, 입주 일정을 진행하고 있다. 노량진뉴타운과 서울 도심, 분당과 경기광주, 동탄과 영통, 천안·안동·인천... "
GS건설,2026-04-17,"GS건설, 3751억 봉천4-1-3구역 재개발 수주 [공시pick]",http://www.joseilbo.com/news/news_read.php?uid=566775&class=17&grp=,"계약금액은 3751억원으로, GS건설의 지난해 연결기준 매출액 대비 약 3.01% 수준이다. 공사기간은 실착공일로부터 약 42개월이다. 대금은 분양대금 등 사업 수입금으로 지급되는 방식이다. 회사는 계약금액과 공사기간... "
GS건설,2026-04-15,"GS건설, 모듈러 신기술 개발 성과…“OSC 확대”",https://www.g-enews.com/view.php?ud=202604151012248035ac06cade6e_1,양사가 공동 개발하는 모듈러 엘리베이터는 GS건설이 지난해 12월 수주한 시흥거모 A-1BL 통합형 민간참여 공공주택 사업의 스틸 모듈러 동에 파일럿 프로젝트로 적용될 예정이다. 시흥거모 A-1BL 공공주택은 6개 동으로... 
DL이앤씨,2026-04-22,"입찰 무효 피했지만 신뢰 흠집... DL이앤씨, 압구정5구역 민심 잡을까",https://www.insight.co.kr/news/551095,서울 압구정5구역 재건축 수주전에서 경쟁사 제안서 촬영 논란에 휘말린 DL이앤씨가 상황 수습에 힘쓰고 있다. 22일 정비업계에 따르면 박상신 DL이앤씨 대표이사 부회장은 최근 압구정5구역 재건축 조합에 자필 사과문을... 
DL이앤씨,2026-04-21,변수 없던 목동6단지…DL이앤씨 수주 가시화,http://www.wikileaks-kr.org/news/articleView.html?idxno=186554,DL이앤씨가 서울 양천구 목동6단지 재건축사업 시공권 확보에 다가섰다. 21일 오후 양천구 목동동로 소재 조합사무실에서 열린 목동6단지 현장설명회에 DL이앤씨만 단독으로 참여했다. 이번 현장설명회에 DL이앤씨 단독... 
DL이앤씨,2026-04-21,'5구역 도촬' 논란도 모자라… 압구정3구역까지 뒤흔든 DL이앤씨,http://www.newswell.co.kr/news/articleView.html?idxno=18017,강남 재건축 최대어로 꼽히는 압구정3구역(투시도) 현장 설명회에서 DL이앤씨의 돌발 참여 논란이 커지고 있다. /사진=서울시 서울 강남 재건축 최대어로 꼽히는 압구정3구역 현장 설명회에서 불거진 DL이앤씨의 돌발 참여... 
DL이앤씨,2026-04-21,"DL이앤씨, 노량진 ‘하이엔드 단지’… 5월 987가구 분양",https://www.seoul.co.kr/news/economy/estate/2026/04/21/20260421016004?wlog_tag3=naver,"DL이앤씨는 노량진8재정비촉진구역을 재개발한 ‘아크로 리버스카이’를 오는 5월 분양한다. 단지는 지하 4층~지상 29층, 10개 동, 총 987가구 규모로 조성된다. 전용면적 36~140㎡ 중 285가구가 일반분양 물량이다.... "
DL이앤씨,2026-04-21,[단독] DL이앤씨 ‘아크로 목동’ 펫네임 3건 연달아 출원…30조 목동 수...,https://biz.heraldcorp.com/article/10722351?ref=naver,"아크로 목동센트럴·목동리젠시 등 3건 출원 DL이앤씨, 6단지 단독 응찰…수의계약 전망 서울 양천구 목동 일대 아파트 단지 모습. [연합] [헤럴드경제=신혜원 기자] DL이앤씨가 총사업비가 약 30조원에 달하는 목동... "
DL이앤씨,2026-04-20,"DL이앤씨, 'e편한세상 부천 어반스퀘어' 공급 본격화…총 1649가구",http://www.paxetv.com/news/articleView.html?idxno=270124,[사진=DL이앤씨] DL이앤씨가 경기 부천 원미구 소사동 일원에 조성하는 'e편한세상 부천 어반스퀘어'의 주택전시관을 오픈하고 분양에 나선다고 20일 밝혔다. 소사3구역 주택재개발정비사업을 통해 조성되는 이... 
DL이앤씨,2026-04-20,"DL이앤씨, 국내 건설사 최초 X-energy SMR 표준화 설계 계약",http://www.samdailbo.com/news/articleView.html?idxno=263069,DL이앤씨가 차세대 핵심 에너지 인프라로 주목받는 SMR(소형모듈원전) 설계에 대한 건설사 간 경쟁에서 우위를 달리고 있다. DL이앤씨는 최근 국내 건설사 중 최초로 미국의 원전 기업인 X-energy(엑스에너지)와 SMR... 
DL이앤씨,2026-04-18,DL이앤씨·GS건설 컨소시엄 등 분양·청약 ‘동시 진행’,http://www.fntimes.com/html/view.php?ud=202604180047134790048b718333_18,"DL이앤씨를 비롯해 GS건설·SK에코플랜트와 LH가 서울과 수도권, 지방 주요 지역에서 분양과 청약, 준공, 입주 일정을 진행하고 있다. 노량진뉴타운과 서울 도심, 분당과 경기광주, 동탄과 영통, 천안·안동·인천... "
DL이앤씨,2026-04-17,"DL이앤씨, '코리안리재보험 신사옥 건립공사' 수주…2030년 준공 예정",https://www.dailian.co.kr/news/view/1634833/?sc=Naver,"DL이앤씨는 서울 종로구 수송동 80번지 일원에 들어서는 ‘코리안리재보험 신사옥 건립 공사’를 수주했다고 17일 밝혔다. 글로벌 재보험사인 코리안리재보험의 신사옥 건립 사업은 업무 환경 고도화, 도심 녹지 및... "
DL이앤씨,2026-04-16,DL이앤씨 '볼펜 몰카'에 압구정 재건축 멈춰버렸다,https://www.theguru.co.kr/news/article.html?no=100656,"만약 입찰 무효 판정과 함께 DL이앤씨에 대해 재참여 제한이 걸릴 경우 현대건설 단독 수주 혹은 유찰 가능성도 나온다. 반대로 강남구가 경고 수준으로 사건을 일단락할 경우, 현대건설이 ‘시공사 선정 효력 정지... "
