company,date,title,link,description
삼성물산,2026-06-15,"삼성물산·GS건설, 정비사업 수주·신규 분양 확대",https://www.polinews.co.kr/news/articleView.html?idxno=734135,건설사들이 정비사업 수주와 신규 주택 공급을 통해 주택사업 확대에 나서고 있다. 서울 강남권 재건축... 15일 업계에 따르면 삼성물산은 서울 서초구 방배동 일대 방배신삼호 재건축 사업의 시공사로 최종 선정됐다.... 
삼성물산,2026-06-15,"건설도 이제는 친환경 시대… 삼성물산, 스마트 모듈러 건축으로 신성장...",https://www.pinpointnews.co.kr/news/articleView.html?idxno=460073,삼성물산은 국내 건설업계 최고 수준의 기술력과 대형 프로젝트 수행 능력을 바탕으로 모듈러 건축 시장에서도 경쟁력을 확보할 것으로 평가받는다. 스마트 건설 기술과 친환경 건축 수요 확대가 긍정적인 투자 포인트로... 
삼성물산,2026-06-14,"삼성물산 17곳 전승…오세철 '거점형 선별수주', 도시정비 판 흔들었다",https://www.apnews.kr/news/articleView.html?idxno=3049061,"©AP신문(AP뉴스)/이미지 제공 = 삼성물산 ▲오세철 삼성물산 건설부문 대표이사 사장. 삼성물산 건설부문(028260, 이하 삼성물산)이 도시정비사업에서 파죽지세다. 지난해 한남4구역 재개발을 시작으로 최근 신반포19·25차... "
삼성물산,2026-06-11,"삼성물산, 포스터+파트너스, 성수3지구 설계 참여…세계적 건축물 노하...",https://www.datasom.co.kr/news/articleView.html?idxno=208887,"삼성물산은 앞서 압구정4구역 재건축 사업에서 포스터+파트너스와 협업한 데 이어, 이번 성수3지구 재개발에서도 양사 간 파트너십을 강화해 차별화된 설계를 선보일 방침이다. 성수3지구는 서울 성동구 성수동2가 일대... "
삼성물산,2026-06-11,"집안 일감에 원전 특수까지…삼성물산, 성장 엔진 '업그레이드'",https://www.mediapen.com/news/view/1103792,"특히 반도체 공장 건설에서 주 설비를 삼성물산이 담당해 왔던 만큼, 건설 계열사 내에서도 삼성물산의 수주 비중이 가장 클 것으로 예상된다. 실제 계열사 발주 물량은 주택 경기 둔화와 내수 침체가 겹친 상황에서... "
삼성물산,2026-06-11,"""AI가 종합상사도 바꿨다""…삼성물산 새 신성장동력은 '데이터센터'",https://www.newsis.com/view/NISX20260611_0003665273,삼성물산의 태양광 개발사업 매각 이익은 지난 2021년 약 2200만 달러(336억원) 수준이었으나 올해는 약 8500만 달러(1298억원)에 이를 것으로 전망된다. 5년 만에 4배 가까이 성장한 셈이다. 삼성물산은 여기서 한발 더 나아가... 
삼성물산,2026-06-10,"삼성물산, 2차전지 화재 막는다…스마트 충전함 공동개발",https://www.news1.kr/realestate/general/6192736,삼성물산은 2차 전지 배터리 사용 증가에 따른 화재를 예방하기 위해 자기 소화 기능을 특징으로 하는 '스마트 충전함'을 래미안 엘라비네(방화6구역 재건축) 건설 현장 등에 도입했다고 10일 밝혔다. 현재 아파트 건설... 
삼성물산,2026-06-10,"조직 재편부터 기술 개발까지...삼성물산, 단지 내 '화재안전 패러다임...",http://www.popcornnews.net/news/articleView.html?idxno=123484,기술은 향후 분양하는 신규 래미안 단지부터 순차 적용된다. 삼성물산은 주택개발사업부 내 소방안전 전담 조직 '소방기술그룹'도 신설했다. 하드웨어뿐 아니라 소프트웨어 역량도 강화한 것. 소방안전 관련 자격증 소지... 
삼성물산,2026-06-10,삼성물산 '소방 신기술' 포문···달아오르는 하이엔드 방재 경쟁,https://www.newsfreezone.co.kr/news/articleView.html?idxno=693840,업계에서는 하반기 한강변 수주전의 판도를 선점하려는 삼성물산의 전략이 담겨 있다는 관측이 나온다. 최근 한강변 일부 단지의 평당 공사비가 1300만원을 돌파하는 등 업계 전반에 가격 반발이 거세지자 비싼 공사비에... 
삼성E&A,2026-06-17,"한성크린텍, 삼성E&A와 222억원 규모 평택 설비공사 공급계약",https://www.edaily.co.kr/news/newspath.asp?newsid=04946246645482704,한성크린텍(066980)은 삼성E&A와 221억7775만원 규모의 평택 P5 Ph1 초순수 복합동 설비공사A 계약을 체결했다고 17일 공시했다. 계약금액은 최근 매출액 대비 11.09% 규모다. 계약 기간은 이날부터 2027년... 
삼성E&A,2026-06-15,"중동 재건 시동 걸렸다...삼성E&A, 글로벌 플랜트 기술력 앞세워 수주전...",https://www.pinpointnews.co.kr/news/articleView.html?idxno=460104,삼성E&A는 9.66% 상승한 5만2200원에 거래중이다. 플랜트와 산업설비 건설 분야에서 글로벌 경쟁력을 확보하고 있어 중동 지역 재건 사업 수혜 기대가 부각되고 있다. 에너지 플랜트와 산업시설 복구 시장 확대가 성장... 
삼성E&A,2026-06-11,"삼성E&A, 매출·영업익 감소에도 수익성 굿!…New Energy 실적화는 과제",http://www.newsworker.co.kr/news/articleView.html?idxno=430678,"국내 EPC 업계가 글로벌 경기 둔화와 발주 지연, 원가 부담을 겪는 가운데 삼성E&A(대표, 남궁홍)의 실적 흐름이 주목된다. 지난해 매출과 영업이익은 모두 감소했지만, 순이익 증가와 배당 확대를 통해 일정 수준의... "
삼성E&A,2026-06-10,[헬로스톡] 6/10 주목할 종목 : 현대건설·삼성E&A·NH투자증권·하나마...,https://www.hellot.net/news/article.html?no=113122,"삼성E&A — 사우디·UAE 가스 투자 확대, EPC 수혜 최전선 삼성E&A(028050)는 이번 테크포럼 탐방을 통해 중동 지역에서의 가스 수주 확대 가능성을 확인했다. EPC(설계·조달·시공)란 대형 플랜트 건설 전 과정을... "
대우건설,2026-06-17,"대우건설, 목동에 '써밋' 브랜드 거점 마련…재건축 수주전 채비",https://www.fetv.co.kr/news/articleView.html?idxno=304532,대우건설이 서울 양천구 목동에 하이엔드 주거 브랜드 '써밋(SUMMIT)' 전용 라운지를 열고 정비사업 수주 경쟁에 나섰다. 재건축 추진이 본격화되는 목동 일대에서 브랜드 인지도를 높이고 조합·주민과의 접점을... 
대우건설,2026-06-16,[헬로스톡] 6/16 주목할 종목 : 두산·대우건설·삼성E&A·심텍,https://www.hellot.net/news/article.html?no=113249,"대우건설 — 체코 원전 레퍼런스로 글로벌 EPC 재평가 시작 대우건설이 체코 두코바니 원전 수주로 첫 해외 원전 시공 레퍼런스를 확보했다. EPC(Engineering, Procurement & Construction)는 설계·조달·시공을 일괄... "
대우건설,2026-06-16,"대우건설, 시니어주택 사업 확대 본격화…원전 수주 모멘텀도 주목",http://www.biztribune.co.kr/news/articleView.html?idxno=354831,15일 오후 2시 서울시 중구에 위치한 대우건설 본사에서 대우건설 건축사업본부 전용수 본부장(왼쪽에서 7번째)과 신한라이프케어 우석문 대표이사(오른쪽에서 7번째)가 시니어주택 사업 분야 협력을 위한 업무 협약을... 
대우건설,2026-06-16,"대우건설, 강북 최대 장위뉴타운…돌곶이역 인접",https://www.mk.co.kr/article/12075482,"장위 푸르지오 마크원 대우건설이 서울 성북구 장위동 68-37 일원에 '장위 푸르지오 마크원'을 분양한다. 장위뉴타운(장위재정비촉진지구) 10구역을 재개발하는 이 단지는 지하 5층~지상 35층, 23개 동 1931가구로 구성된다.... "
대우건설,2026-06-16,"인천글로벌시티, 3단계 사업 시공사 적격심사 결과 발표…대우건설 등 ...",https://www.kyeonggi.com/article/20260616580459,"인천글로벌시티(IGCD)는 송도국제도시 11공구에 조성하는 3단계 사업에 대우건설, 롯데건설, 현대산업개발, 호반건설 총 4개 업체가 시공사 선정 적격심사를 통과했다고 16일 밝혔다. IGCD는 송도국제도시 내 첨산산업... "
대우건설,2026-06-16,10兆 대어 가덕신공항···대우건설에 '독이 든 성배' 되나,https://www.sisajournal-e.com/news/articleView.html?idxno=421777,대우건설이 10조7000억원 규모의 가덕도신공항 부지조성공사를 맡았지만 착공 전부터 공사비 부담이 커지고 있다. 해상 매립과 연약지반 처리 등 고난도 공정에 비해 당초 책정된 공사비가 빠듯하다는 지적이 이어진... 
대우건설,2026-06-12,[건설 라운지] 대우건설·SK에코플랜트·GS건설·현대건설...해외 수주·...,http://www.kdfnews.com/news/articleView.html?idxno=184156,대우건설이 시공한 인도라마 비료 플랜트 3호기 현장 전경. 대우건설은 나이지리아에서 수행한 '인도라마... 회사는 이를 바탕으로 후속 사업 수주와 아프리카 시장 확대를 적극 추진할 계획이다. 나이지리아 진출 44년... 
대우건설,2026-06-12,[단독]의정부 가능4구역 재개발 시공권에 대우건설·BS한양 '관심',https://daily.hankooki.com/news/articleView.html?idxno=1376135,사진=카카오맵 로드뷰 경기도 의정부시 가능4구역 재개발 사업 시공권을 두고 대우건설과 BS한양이 관심을 드러냈다. 12일 가능4구역 재개발조합에 따르면 이날 조합사무실에서 진행된 시공사 현장설명회(현설)에... 
대우건설,2026-06-12,"[성수대전] 대우건설, 신용등급 '부정적' 굳어지나",https://www.the-stock.kr/news/articleView.html?idxno=32712,신용등급은 대우건설 채무 이자비용을 결정짓는다. 수주전에도 영향을 미칠 수 있다. 특정 사업장에 필요한 비용을 연대보증할 경우 신용도에 따라 역시 이자가 달라질 수 있다. 대우건설이 대규모 재개발 사업인... 
대우건설,2026-06-11,"대우건설, 건설산업 상생협력·공정거래 확산 추진 [건설·분양오늘]",https://www.sisaon.co.kr/news/articleView.html?idxno=201786,"대우건설은 지난달 28일 열린 '건설산업 상생협력 및 공정거래 협약식'에 참석해 공정거래위원회와... 동부건설, 올해 수주 1조원 돌파...전년비 138% 증가 동부건설이 올해 신규 수주액 1조 원을 넘어섰다고 11일... "
GS건설,2026-06-17,"7조 쌓은 GS건설, 정비사업 시계는 '착공'으로",https://www.wolyo.co.kr/news/articleView.html?idxno=313637,"GS건설이 올해 도시정비사업에서 7조원대 수주를 기록하며 연간 목표 8조원에 근접했다. 수주액은 이미 지난해 연간 실적을 넘어섰다. 시공사 선정 이후 본계약, 인허가, 관리처분, 착공까지 절차가 이어지는 정비사업... "
GS건설,2026-06-17,"GS건설 협업 아모지, 일본 기업과 암모니아 분해 수소 공급 위한 파트너...",https://www.theguru.co.kr/news/article.html?no=103193,"GS건설과 한국 사업에 협력하고 있다. 코와는 130년 역사를 지닌 대기업으로, 제약·에너지·섬유·기계·건자재 등 다양한 사업을 영위하고 있다. 우성훈 대표는 ""일본은 세계적인 수소·암모니아 시장 중 하나""라며 ""이번... "
GS건설,2026-06-16,"GS건설, 북오산자이 드포레 22일 청약…1517가구 공급",https://www.news1.kr/local/gyeonggi/6199183,"GS건설이 경기 오산시 내삼미2구역 A2블록에 들어서는 '북오산자이 드포레'를 분양한다. 16일 GS건설에 따르면 단지는 지하 2층~지상 29층, 11개 동, 총 1517가구 규모다. 지난 1월 분양한 '북오산자이 리버블시티... "
GS건설,2026-06-16,"[드림&CEO] 흙먼지 마다않는 '현장형' 허윤홍 대표, GS건설에 '혁신 DNA' ...",http://www.newsdream.kr/news/articleView.html?idxno=113058,'발로 뛰는 리더.' 허윤홍 GS건설 대표를 상징하는 수식어인데요 이 수식어는 단순한 수사가 아닙니다. 2023년 말 취임 이후 체질 개선의 고삐를 죄고 있는 허 대표의 행보 중심에는 언제나 '현장'이 자리하고 있습니다. 허... 
GS건설,2026-06-15,"'팀코리아' 베트남 원전 수주전…GS건설, 해외 원전 진출 기대감↑",https://www.mt.co.kr/estate/2026/06/15/2026061113473521594,한국전력과 한국수력원자력이 '팀코리아'를 구성해 해외 원전 수주전에 나선 가운데 GS건설의 첫 해외 원전 수출 가능성에 관심이 쏠린다. 15일 업계에 따르면 GS건설은 팀코리아의 베트남 닌투언 2호 원전 사업 수주... 
GS건설,2026-06-15,장애인 접근로 없는 연립주택 하자 판정…法 “GS건설 책임 인정”,https://www.sedaily.com/article/20055611?ref=naver,장애인 접근로가 없는 연립주택을 시공해 하자 판정 처분을 받은 GS건설(006360)이 불복 소송을 제기했지만 패소했다. 설계도면대로 시공했더라도 법령 위반 사실을 발견했다면 시공사가 이를 적극적으로 알리고 의견을... 
GS건설,2026-06-15,"법원 ""경사로 미설치는 하자""···GS건설, 국토부 판정 취소 청구 기각",http://www.finomy.com/news/articleView.html?idxno=255686,현대경제신문 임이랑 기자 | 장애인 이동을 위한 경사로를 일부 설치하지 않은 GS건설이 국토교통부의 하자 판정에 불복해 소송을 제기했으나 법원이 이를 받아들이지 않았다. 15일 서울행정법원 행정2부(공현진... 
GS건설,2026-06-13,라이프스타일 변화가 부른 주거 기준 전환..GS건설 1174가구 규모 백석시...,http://www.fnnews.com/news/202606121433098473,"24대 1의 경쟁률을 보였으며, 5월 경남 창원에서 분양한 단지도 사우나와 영화관 등 여러 편의시설을 설계에 반영해 평균 15.19대 1의 경쟁률로 청약 접수를 마감했다. GS건설은 충청남도 천안시 서북구 백석동 일원에... "
GS건설,2026-06-12,AI 전력 수요 폭증에 원전주 부각…태광 한미글로벌 삼미금속 GS건설 대...,https://www.pinpointnews.co.kr/news/articleView.html?idxno=459653,"한미글로벌과 삼미금속이 나란히 강세를 기록하고 있으며, GS건설과 대우건설 역시 해외 원전 사업 참여... 증시 전문가들은 ""원전 산업은 단기 이슈보다 수주와 프로젝트 진행 상황이 기업가치에 직접 영향을 미치는... "
GS건설,2026-06-11,"[산업 HOT 뉴스] GS건설, 대동로보틱스와 건설현장 로봇 기술 개발위해...",http://www.bizwnews.com/news/articleView.html?idxno=138409,지난 5일 서울 서초동 GS건설 R&D센터에서 열린 'AI 필드로봇 활용 건설현장 자동화를 위한 연구개발 협력' 업무협약 체결식에서 GS건설 조성한 미래기술원장(왼쪽)과 대동로보틱스 강성철 대표이사가 기념촬영을 하고... 
DL이앤씨,2026-06-17,목동 14개 단지 재건축 '수주경쟁' 본격…대우건설·DL이앤씨 등 홍보관...,https://www.edaily.co.kr/news/newspath.asp?newsid=04778966645482704,"재건축 속도가 가장 빠른 6단지는 27일 시공사 선정을 위한 조합원 총회를 열고 DL이앤씨와의 수의계약 여부를 확정한다. 10단지는 15일 시공사 입찰 공고를 냈고, 8월 10일 입찰을 마감한다. 4단지는 7월, 7단지와 14단지는... "
DL이앤씨,2026-06-17,"""850가구 한강 조망 가능""…DL이앤씨, 목동6단지 수주 총력전[르포]",https://www.newsis.com/view/NISX20260617_0003672688,"동간 거리를 최대한 확보하고 간섭을 최소화했기 때문에 높이만 충족된다면 조망이 확보됩니다."" (DL이앤씨 관계자) 17일 방문한 서울 양천구 '아크로 목동리젠시' 홍보관. 터치스크린 속 '104동'과 '49층'을 클릭하자... "
DL이앤씨,2026-06-17,지난해 10대 건설사 중 9곳 인력 감축…DL이앤씨 15%↓ ‘최대’,https://www.ceoscoredaily.com/page/view/2026061615362536134,"SK에코플랜트만 유일하게 증가세를 보였고 DL이앤씨의 감소폭이 15%로 가장 컸다. 17일 CEO스코어데일리가 금융감독원전자공시시스템을 분석한 결과, 지난해 말 기준 10대 건설사의 직원수는 총 4만9370명으로... "
DL이앤씨,2026-06-17,[소소한 경영] 발소리 크면 알람 '깜빡깜빡'...DL이앤씨 'D-사일런스' 층...,http://www.consumernews.co.kr/news/articleView.html?idxno=757575,[편집자 주] DL이앤씨(대표 박상신)가 공동주택 층간소음 갈등을 줄이기 위해 국내 최초로 층간소음 알림 서비스 적용을 확대하며 브랜드 경쟁력을 높이고  있다. 층간소음 차단구조 기술 개발에 그치지 않고 입주민이... 
DL이앤씨,2026-06-16,"키움證 ""DL이앤씨, 종전합의 수혜…현지 수주이력 주목""",https://www.yna.co.kr/view/AKR20260616029000008?input=1195m,키움증권은 16일 미국과 이란의 종전 합의 양해각서(MOU) 체결로 이란 경제 제재가 해제될 경우 DL이앤씨가 국내 건설사 중 가장 큰 수혜를 볼 것으로 전망했다. 신대현 연구원은 DL이앤씨의 실질적인 재건 노출도는 높지... 
DL이앤씨,2026-06-16,"DL이앤씨, 고부가 도시개발·에너지 인프라로 포트폴리오 다변화",https://www.pinpointnews.co.kr/news/articleView.html?idxno=460471,DL이앤씨는 12.28% 상승한 8만8700원에 거래중이며 해외 대형 플랜트와 도시개발 사업 확대 기대를 받고 있다. 철저한 수익성 중심의 선별 수주 기조 속에서 신성장동력을 확보하겠다는 구상이다. 최근 국내 주택 경기의... 
DL이앤씨,2026-06-16,서울 목동에 '아크로 타운' 꿈꾸는 DL이앤씨,https://www.newsway.co.kr/news/view?ud=2026061615240935715,DL이앤씨가 서울 목동 재건축 시장에 '아크로 벨트' 구축 전략을 꺼내 들었다. 목동신시가지6단지 시공권 확보를 목표로 14단지와 1~3단지까지 사업 영역을 넓혀 서울 서남권에 대규모 아크로 타운을 조성하겠다는... 
DL이앤씨,2026-06-15,"DL이앤씨 플랜트 수주 돌파구 열어, 박상신 미국 이란 종전 뒤 중동에서...",https://www.businesspost.co.kr/BP?command=article_view&num=440011,DL이앤씨가 올해 도시정비사업에서 아직 수주 실적을 올리지 못한 가운데 플랜트 사업에서 대규모 신규 일감을 확보하며 수주 실적을 보완하고 있다. 박상신 DL이앤씨 대표이사 부회장으로서는 올해 하반기 미국 이란... 
DL이앤씨,2026-06-15,"DL이앤씨, 동제주 복합발전소 공사 따냈다…친환경 에너지 전환 '가속화...",https://www.econovill.com/news/articleView.html?idxno=742392,DL이앤씨가 발전소 수주로 친환경 에너지 전환에 속도를 내고 있다. 최근 5500억원 규모의 동제주 가스복합발전소 건설공사를 따내면서 친환경 사업분야로 성과를 이어가고 있다. 엑스에너지와 소형모듈원전(SMR)... 
DL이앤씨,2026-06-15,'탄소 없는 섬' 제주에 발전소 짓는 DL이앤씨…5500억 일감 확보,https://www.mediapen.com/news/view/1104384,"이번 수주에는 DL이앤씨의 발전플랜트 설계 역량이 주효했던 것으로 알려졌다. 회사는 발전소 핵심 설비인 가스터빈과 스팀터빈, 배열회수보일러(HRSG)의 성능을 분석해 운전 조건 변화에도 효율을 유지할 수 있는... "
