company,date,title,link,description
삼성물산,2026-05-14,신반포19·차25차 재건축 설명회 개최…포스코이앤씨·삼성물산 사업 조...,https://www.safetynews.co.kr/news/articleView.html?idxno=248338,"이번 수주전은 기호 1번 포스코이앤씨와 기호 2번 삼성물산의 2파전으로 치러지는 가운데, 양측은 공사비 산정 방식과 금융 지원책을 두고 서로 다른 전략을 제시했다. 설명회에서 포스코이앤씨는 공사비 상승 리스크... "
삼성물산,2026-05-13,"삼성물산, 서울 강남 재건축 집중 공략",https://www.sisaon.co.kr/news/articleView.html?idxno=201024,"이들 사업지는 지난해 다른 건설사들이 시공권을 확보하려다가 무산된 곳들로, 조합원들이 시공사로 삼성물산을 선호하고 있다. 시공사 선정총회는 다음달 중 개최될 것으로 예상되며, 삼성물산이 개포우성4차와... "
삼성물산,2026-05-13,"삼성물산, 호주 녹색수소 개발 계약 해지…""철수 아닌 시점 조정""",https://www.ngetnews.com/news/articleView.html?idxno=550250,"삼성물산은 설계와 기자재 조달, 시공, 시운전까지 전 과정을 총괄하는 디벨로퍼 역할을 맡을 계획이었다. 단순 시공을 넘어 개발 단계에서부터 사업 구조를 설계하고 수익 모델을 구축하는 방식이다. 다만 이 같은 투자형... "
삼성물산,2026-05-12,"삼성물산, 그린 에너지 신사업 가속 페달...SMR 공사, 태양광 개발자산...",http://www.consumernews.co.kr/news/articleView.html?idxno=755517,삼성물산 건설부문(대표 오세철)이 친환경 에너지를 중심으로 한 사업재편에 속도를 내고 있다. 협약과 투자 중심이던 수소·소형모듈원전(SMR)·배터리에너지저장장치(BESS) 등 에너지 신사업이 실제 사업 단계로... 
삼성물산,2026-05-12,"삼성물산, 1.1조 현금 수혈로 '안전지대' 입증..'내부거래 의존'은 과제",https://www.koreareport.co.kr/news/articleView.html?idxno=50359,"다만, 1분기 건설 부문 영업이익률은 3.2%(1110억원)에 그쳤다. 삼성물산은 1154억원의 일회성 퇴직급여충당금을 제외하면 '실질 이익률은 5%'라고 강조한다. 충당금도 경영 결과의 산물이라는 점을 고려하면 수익성... "
삼성물산,2026-05-11,SK스퀘어처럼…삼전 업고 삼성물산도 ‘훨훨’ [종목 돋보기],https://www.sedaily.com/article/20042714?ref=naver,이승영 NH투자증권 연구원은 “삼성물산은 건설·바이오·상사 등 사업 포트폴리오에 기반해 실적이 안정적으로 성장 중”이라며 “여기에 더해 원전·SMR 사업 확대를 추진 중인 점도 긍정적”이라고 짚었다. 다만... 
삼성물산,2026-05-10,[현장+] 압구정4에 '컬리넌' 떴다…세계 1등 내건 삼성물산 홍보관 개관,https://www.m-i.kr/news/articleView.html?idxno=1371174,삼성물산은 압구정4구역을 브랜드를 상징할 전략 사업지로 보고 있다. 전날 열린 1차 합동설명회에 사업총괄 부사장이 참석했다. 압구정2·3구역 합동설명회 당시 현대건설 상무급 임원이 참석했던 것과 비교하면... 
삼성물산,2026-05-07,"[Biz&Law] 삼성물산, 인도 지하철 공사지연 보상금 93억 받나",http://www.the-biz.co.kr/news/articleView.html?idxno=720085,"HCC 삼성 JV는 인도의 대형 인프라·토목 건설사 HCC(Hindustan Construction Company)와 삼성물산(Samsung C&T)의 합작사로, 컨소시엄 형태로 손잡고 델리 메트로 지하철 공사를 수주했다. 이번 분쟁은 델리 메트로의 지하철 건설... "
삼성물산,2026-05-07,"[건설 大개조, K-건설 생존 방정식]삼성물산 ""반도체 호재 딛고 글로벌...",https://www.businessplus.kr/news/articleView.html?idxno=111462,"DS투자증권은 삼성물산의 올해 하이테크 연간 수주액이 목표치인 6조8000억원을 상회할 것으로 내다봤다. 기흥 R&D 단지, 베트남 후공정 라인 등 대규모 후속 발주 모멘텀도 가시권에 들어와 있다. 오 사장은 하이테크를... "
삼성물산,2026-05-07,"""상속세 끝나자 20% 폭등""…반도체 공장 건설 수혜까지 업은 삼성물산의...",https://realty.chosun.com/site/data/html_dir/2026/05/07/2026050702724.html,"◇ 공격적인 투자…올해에만 7조 7000억원 수주 목표 삼성물산은 최근 도시정비사업 시장에서도 가장 공격적인 행보를 보이고 있다. 지난해 서울 한남4구역 재개발을 비롯해 개포우성7차, 신반포4차, 장위8구역 등을... "
삼성E&A,2026-05-13,"삼성E&A, 사우디 가스전 수주戰···'화공 명가' 자존심 지킬까",https://www.newsfreezone.co.kr/news/articleView.html?idxno=689397,삼성E&A가 사우디아라비아와 쿠웨이트 접경 중립지대에 위치한 초대형 가스전 개발 사업에 출사표를 던지며 화공(化工) 명가로서의 입지 굳히기에 나섰다. 지난 2024년 창사 이래 최대 규모인 사우디 파딜리(Fadhili)... 
삼성E&A,2026-05-11,"UAE 메탄올 돈줄 열린 삼성E&A, 중동 수주전 재점화",https://www.topstarnews.net/news/articleView.html?idxno=16057487,"UAE 메탄올 플랜트의 자금 조달이 마무리되며 삼성E&A의 중동 사업이 다시 시장 전면에 섰다. 삼성E&A는 1분기 신규 수주 4조6000억원으로 연간 목표 12조원의 약 39%를 채웠고, 중동 발주 회복과 뉴에너지 사업... "
삼성E&A,2026-05-11,"삼성E&A, 중동 사업 존재감 확대…수주 흐름도 안정",http://www.lkp.news/news/articleView.html?idxno=79969,삼성E&A가 올해 1분기 영업이익이 전년 대비 20% 가까이 늘며 실적 개선 흐름을 이어갔다. 사우디 등 중동 대형 프로젝트 매출이 반영된 가운데 1분기 신규 수주도 연간 목표의 40% 수준을 채우며 안정적인 수주 기반을... 
삼성E&A,2026-05-09,볕드는 삼성E&A… 중동 재건 최대 수혜 기대,https://biz.chosun.com/real_estate/real_estate_general/2026/05/09/2KSLC3K5LJFI5MICVMZ6YXWFHA/?utm_source=naver&utm_medium=original&utm_campaign=biz,"수주 잔고 절반 이상이 중동發 매출 비중 1위 사우디 아람코, 2위 삼성전자 반도체 관련 공사 물량 증가 ‘호재’ 올해 신규 수주 12조 목표…전년比 2배 국내 대표 엔지니어링 기업 삼성E&A가 중동 재건 최대 수혜... "
삼성E&A,2026-05-08,"삼성E&A, 내년 영업익 1兆 넘는다-KB證",http://www.fnnews.com/news/202605070804577004,"삼성E&A의 내년 영업이익이 1조원을 넘는다는 관측이 제기됐다. AI(인공지능) 인프라 수요와 에너지 안보 강화 흐름 속에서 발주처가 가장 민감한 변수가 '공기(工期)', 즉 '시간'이 되면서 삼성E&A의 본질적... "
대우건설,2026-05-13,"""학세권 대단지""…대우건설, '동래 푸르지오 에듀포레' 분양",https://www.newsis.com/view/NISX20260513_0003627812,중동발 지정학적 리스크 장기화로 공사비 상승 우려가 커지는 가운데 대우건설이 공급하는 '동래 푸르지오 에듀포레'가 합리적 가격의 대단지로 주목받고 있다. 13일 업계에 따르면 대우건설은 부산 안락동 일대에... 
대우건설,2026-05-13,"'구조적 수익성 개선' 대우건설, 올해를 넘어 중장기 성장 기대",https://www.mediapen.com/news/view/1098522,대우건설이 현재 실적 개선 기조를 이어갈 것이라는 전망이 힘을 얻고 있다. 연간 1만8000가구 분양이 본격화하고 체코 두코바니 원전·가덕도 신공항 등 굵직한 대형 프로젝트 계약도 임박해 있기 때문이다. 여기에... 
대우건설,2026-05-12,"[건설업계 4월 동향②] 대우건설, 글로벌 광폭행보···1분기 호실적",http://www.wsobi.com/news/articleView.html?idxno=311739,"대우건설은 일본 EPC 시장 및 베트남 도시개발 시장 확대와 함께 국내 정비사업 수주에 나서고 임직원들과 함께 ESG 활동을 실시했다. 이와 함께 매출 1조9514억원, 영업이익 2556억원의 1분기 잠정 실적을 공개했다.... "
대우건설,2026-05-11,"대우건설, 노량진 5500억 보증 '장기전'…소송·인허가로 지연",https://www.wolyo.co.kr/news/articleView.html?idxno=311990,대우건설이 노량진 본동 사업 관련한 5500억원 규모의 채무보증을 이어가고 있다. 회사 측은 이번 건은 신규 보증이 아니라 기존 프로젝트파이낸싱(PF) 대출 만기에 따른 리파이낸싱 성격이라고 설명했다. 해당 사업은... 
대우건설,2026-05-08,"""가덕도 106개월의 사투""...해상공항 난제 뚫는 대우건설의 기술력",https://www.youthdaily.co.kr/news/article.html?no=218744,8일 업계에 따르면 대우건설 컨소시엄은 지난 3월 수의계약 대상자로 선정된 이후 현장설명회를 거쳐 6개월 일정의 기본설계를 진행하고 있다. 현재 설계 착수 2개월 차를 맞은 컨소시엄은 연내 우선시공분 착공을... 
대우건설,2026-05-08,[#부동산 나들이] '대우건설 네이처' 준공·LH '통합공시 무벌점',https://www.newsworks.co.kr/news/articleView.html?idxno=840130,대우건설이 친환경 생태정원 '대우건설 Nature'를 준공했고 LH가 기획재정부 주관 '공공기관 통합공시 점검'에서 무벌점을 받았다. ◆'대우건설 네이처' 준공 대우건설이 친환경 생태정원 '대우건설 Nature'를 준공했다.... 
대우건설,2026-05-07,"대우건설·IPARK현산, 1분기 영업이익률 10% 넘겼다…현대건설은 2.9%",https://www.ceoscoredaily.com/page/view/2026050613504123385,"대우건설 관계자는 “공사원가 상승기에 착공한 현장들이 준공됐고, 도급 증액 등을 통해 원가 상승 부담을 일부 완화하면서 수익성이 개선됐다”고 설명했다. IPARK현대산업개발은 영업이익률이 11.8%를 기록, 전년(6.... "
대우건설,2026-05-07,[대우건설 부활] ②원전·데이터센터 겨냥 '사업 재설계',https://www.fetv.co.kr/news/articleView.html?idxno=301782,"대우건설 관계자는 ""외부 환경 변화에 발맞춰 포트폴리오 다각화와 양질의 수주 확대를 통한 체질 개선을 추진 중""이라며 ""조직 개편과 사업 구조 정비를 통해 지속 가능한 성장 기반을 강화해 나갈 것""이라고 말했다."
대우건설,2026-05-07,"삼성·대우건설, 2026 주택시장 전략 바뀌나…KB '정책이 최대 변수'",http://www.fntimes.com/html/view.php?ud=202605071904086271048b718333_18,특히 서울 핵심 재건축 경쟁력을 보유한 삼성물산 건설부문과 지방 주택사업 비중이 상대적으로 큰 대우건설은 시장 흐름 변화에 따라 서로 다른 영향을 받을 수 있다는 관측이 나온다. 공급 감소와 월세화 심화가 이어질... 
GS건설,2026-05-13,"허윤홍 GS건설 대표, 성수·강남 '무혈입성'…도시정비 8조 목표 순항",https://www.insightkorea.co.kr/news/articleView.html?idxno=246326,허윤홍 대표가 이끄는 GS건설이 주택 경기 불황 속에서도 선별 수주 전략으로 수익성을 방어하고 있다. 회사는 인프라·플랜트 등으로 포트폴리오를 다각화하고 있지만 주축은 여전히 건축주택 부문이라는 분석이... 
GS건설,2026-05-13,재건축 기대 커지는 목동…GS건설 '윤슬자이' 분양,https://www.insightkorea.co.kr/news/articleView.html?idxno=246298,"신축 공급이 흔치 않은 상황인 가운데 GS건설은 오는 6월 '목동윤슬자이'를 분양한다. 이 단지는 서울 양천구 목동 옛 KT부지에 들어서며 오피스텔 지하 6층~지상 48층, 3개 동 총 651실과 근린생활시설, 업무시설이... "
GS건설,2026-05-13,"[건설 大개조, K-건설 생존 방정식]GS건설, '자이' 넘어 '글로벌 디벨로...",https://www.businessplus.kr/news/articleView.html?idxno=111691,"[편집자주] GS건설이 '자이'(Xi)라는 강력한 주택 브랜드를 뛰어넘어 글로벌 에너지·인프라 시장을 정조준하고 있다. 허윤홍 GS건설 대표이사 사장은 올해를 ""미래 역량을 키우며 지속가능한 성장 체계를 완성하는 중요한... "
GS건설,2026-05-12,"[건설업계 4월 동향①] GS건설, 글로벌 시장 공략·정비사업 수주 박차",http://www.wsobi.com/news/articleView.html?idxno=311730,"GS건설의 경우 미국과 인도, 베트남 등 글로벌 시장에서 재생에너지와 데이터센터 인프라 등 신규 먹거리 확보에 나서는 한편 국내 정비사업 시장에서 신규 수주에 성공했다. 이와 함께 GS건설은 매출 2조4005억원... "
GS건설,2026-05-11,"새턴바스, GS건설 자회사 하임랩과 프리미엄 욕실 리모델링 MOU 체결",https://www.dnews.co.kr/uhtml/view.jsp?idxno=202605081752245510075,새턴바스는 GS건설 자회사 하임랩과 프리미엄 욕실 리모델링 및 미래형 욕실 솔루션 개발을 위한 업무협약을 체결했다고 10일 밝혔다. 양사는 이번 협약을 통해 △프리미엄 욕실 인테리어 패키지 공동 개발 △노후 주택... 
GS건설,2026-05-08,"[AI 주거혁신] ⑤GS건설, '피지컬 AI' 전면화…로봇 기반 현장 혁신 속도",http://www.hansbiz.co.kr/news/articleView.html?idxno=837602,GS건설 사옥(그랑서울)./GS건설 | 서울=한스경제 한나연 기자 | GS건설이 건설 현장에 로봇과 인공지능(AI)을 결합한 '피지컬 AI(Physical AI)' 개념을 본격화하며 현장 운영 방식 전환에 속도를 내고 있다. 기존 AI 기술이 데이터... 
GS건설,2026-05-07,"되살아난 DL이앤씨 시공권...GS건설이 노린 상대원2구역 1조 사업, 소송...",https://www.insight.co.kr/news/553034,"GS건설이 새 시공사로 올라서려던 성남 상대원2구역 재개발 사업이 법원 결정 이후 본안소송 변수에 걸렸다. 조합은 DL이앤씨와의 시공계약 해지를 의결한 뒤 GS건설 선정을 추진했지만, 법원이 해지 결의 효력을... "
GS건설,2026-05-07,재건축 시장서 GS건설 '불안한 질주'…압구정·성수 수주전 따라 순위 요...,https://www.socialvalue.kr/news/view/1065601788445244,"◇ GS건설, 성수·강남 핵심지 잇단 확보 GS건설이 수주에 성공한 성수1지구는 공사비만 2조원을 넘는 초대형 사업장이다. 성수동1가 일대를 지하 5층~지상 최고 64층, 3014가구 규모로 재개발하는 사업으로... "
DL이앤씨,2026-05-14,"DL이앤씨 '안양 에버포레 자연& e편한세상', 1순위 청약 안양 역대 최고...",https://www.hankyung.com/article/202605146598O,DL이앤씨가 경기도 안양시 동안구 일대에 공급한 ‘안양 에버포레 자연& e편한세상’이 1순위 청약에서 안양시 역대 최고 경쟁률을 기록했다고 14일 밝혔다. 한국부동산원 청약홈 자료에 따르면 지난 12일부터... 
DL이앤씨,2026-05-14,"[분양 Pick] 우미건설·현대엔지니어링·DL이앤씨, 수도권 핵심지서 분양...",https://www.lcnews.co.kr/news/articleView.html?idxno=202084,"◆ DL이앤씨, 노량진뉴타운에 하이엔드 감성 '아크로 리버스카이' DL이앤씨는 서울 동작구 노량진8구역을 재개발하는 '아크로 리버스카이'의 주택전시관을 15일 개관한다. 지하 4층~지상 29층, 10개 동, 총 987가구 규모로... "
DL이앤씨,2026-05-13,"“시공 난제 지속 해결”…DL이앤씨, ‘욕실 건식벽체 방수시스템’ 국...",https://www.mk.co.kr/article/12045833,특수 마감재 대형화 통해 시공 생산성 3배↑ 하자율 60%↓ “기술 개발로 업계 선도할 것” DL이앤씨와 한솔홈데코가 공동 개발한 ‘욕실용 건식벽체 방수 시스템’이 국토교통부로부터 건설신기술 인증을 획득했다.... 
DL이앤씨,2026-05-13,"DL이앤씨, 1분기 '삼박자' 행진…주택·건축 수익성·SMR·재무 모두 잡...",https://www.newsquest.co.kr/news/articleView.html?idxno=266260,"DL이앤씨가 올해 1분기 시장 예상치를 크게 넘어서는 실적을 냈다.  핵심인 주택사업 수익성이 빠르게 회복된 데다 자회사 실적 개선, 외환차익 증가, 소형모듈원전(SMR) 사업 기대감까지 겹치며 '수익성 중심 체질... "
DL이앤씨,2026-05-12,"DL이앤씨 압구정5구역 수주전서 현대건설 상대 승부수, 조합원들에게 파...",https://www.huffingtonpost.kr/article/257148,"DL이앤씨가 압구정5구역 재건축 수주전에서 상대적으로 낮은 공사비와 유례없는 금융 조건을 내걸며 승부수를 던졌다. DL이앤씨는 올해 1분기 영업이익률을 전년 대비 4.6%포인트 끌어올린 9.1%까지 회복시키며, 이러한... "
DL이앤씨,2026-05-12,"DL이앤씨, '짠물 경영'의 승리..당기순이익 430% 폭증",https://www.koreareport.co.kr/news/articleView.html?idxno=50367,DL이앤씨가 영업이익을 두 배 가까이 불리며 압도적인 위기 관리 능력을 증명했다. 외형 성장보다는 철저하게 이익이 남는 사업만 골라 잡는 '선별 수주'와 '짠물 관리'가 빛을 발했다는 평가다. DL이앤씨의 1분기... 
DL이앤씨,2026-05-12,"'1%대 미끼금리'까지 등장…압구정5 수주전, DL이앤씨에 쏟아지는 '무리...",https://www.abcn.kr/news/articleView.html?idxno=88010,DL이앤씨가 조합 측에 제시한 '1%대 사업비 대출 금리' 역시 시장에서는 사실상 '미끼 조건'에 가깝다는 비판이 나온다. 현재 금융시장 조달 금리가 3~4% 수준이라는 점을 감안하면 정상적인 사업 구조로는 설명하기 어려운... 
DL이앤씨,2026-05-11,"DL이앤씨, 최저 부채비율로 다진 ""안전판""...주택 편중·정비사업 분쟁...",https://www.youthdaily.co.kr/news/article.html?no=218805,영업익 43%↑ 내실경영...SMR 성과 가시화 3조3천289억원 우발채무...리스크 관리 절실  DL이앤씨가 지난해 건설 경기 침체 속에서도 부채비율을 84.4%까지 낮추며 업계 최고 수준의 재무 건전성을 입증했다. 선별 수주를... 
DL이앤씨,2026-05-08,성남 상대원2구역 재개발 시공권 갈등 장기화…DL이앤씨 지위 일단 유지,https://www.megaeconomy.co.kr/news/newsview.php?ncode=1065579375542570,"이주와 철거가 마무리 단계에 들어선 가운데 시공사 교체 논란이 법적 분쟁으로 번지면서 착공 일정도 불확실해졌다. DL이앤씨는 2015년 이 사업의 시공사로 선정됐고, 2021년 조합과 도급계약을 체결했다. 이후 공사비... "
DL이앤씨,2026-05-08,"압구정 재건축 설계도 AI가 척척…DL이앤씨, 글로벌 무대서 기술력 발표",https://www.newspim.com/news/view/20260508000373,DL이앤씨는 핵심 수주 사업의 주요 의사 결정 과정에 AI 분석 기술을 활용하고 있다. [자료=DL이앤씨] 8일 DL이앤씨는 최근 인천 파라다이스시티에서 열린 팔란티어 테크놀로지스의 'APAC Summit Korea 2026'에 국내 건설사 중... 
