company,date,title,link,description
삼성물산,2026-06-11,"삼성물산, 성수3지구 재개발 영국 설계업체와 맞손…압구정 이어 두 번...",https://view.asiae.co.kr/article/2026061109153026340,삼성물산 건설부문이 서울 성동구 성수전략정비구역 3지구 재개발 사업에서 영국의 글로벌 건축설계사 '포스터 앤드 파트너스'와 손잡는다고 11일 밝혔다. 압구정특별계획구역 4구역 재건축 수주전에서 같은 설계사와... 
삼성물산,2026-06-10,"삼성물산, 자기소화기능 탑재 스마트충전함으로 2차전지 화재예방↑",https://www.catchnews.kr/news/articleView.html?idxno=124858,"삼성물산 관계자는 10일 ""아파트 건설현장의 화재 예방은 물론 입주 이후에도 화재로부터 안전한 주거시설을 만들기 위해 관련 조직과 기술개발을 지속 확대하고 있다""며 ""현장 안전과 생활 안전을 아우르는 통합 화재... "
삼성물산,2026-06-09,"상반기 도시정비 수주고, 현대건설·GS건설 ‘양강 체제’… 삼성물산 ...",https://www.theguru.co.kr/news/article.html?no=102821,서초·강남·한강변 위주의 하이엔드 브랜드 전략을 바탕으로 내실 중심의 수주 성과를 거두었다는 평가다. 삼성물산은 지난 1분기 실적 컨퍼런스콜을 통해 올해 도시정비 목표 수주액을 기존 7조 7000억 원에서 13조... 
삼성물산,2026-06-09,"삼성물산, 美 데이터센터 개발 사업 나선다",https://biz.heraldcorp.com/article/10767094?ref=naver,삼성물산 건설 부문은 국내 건설경기 부진에 따른 실적 악화를 최소화하기 위해 데이터센터 프로젝트 수주를 모색하고 있다. 상사 부문의 데이터센터 개발 사업이 정상궤도에 오를 시 건설 부문은 EPC(설계·조달·시공)... 
삼성물산,2026-06-06,SMR·에너지까지 품었다… 삼성물산 성장 스토리 주목,https://www.pinpointnews.co.kr/news/articleView.html?idxno=458053,차세대 에너지 기술로 평가받는 SMR 시장이 성장할 경우 삼성물산이 보유한 사업 역량과 투자 가치가 함께 부각될 수 있다는 전망이 나온다. 이처럼 삼성물산은 지분가치 상승과 자체 사업 성장이라는 두 가지 축을 동시에... 
삼성물산,2026-06-05,삼성전자·생명 배당 품은 삼성물산…건설·신사업 실탄 두둑,https://www.news1.kr/realestate/general/6187940,"삼성물산의 본업인 건설사 신사업 투자 확대로 이어질 수 있다고 분석한다. 건설 부문의 경우, 삼성전자의 평택 반도체 라인과 미국 테일러 파운드리 공장 등 대규모 하이테크 시공 물량을 안정적으로 수행하며... "
삼성E&A,2026-06-12,"물 부족 세상, 바닷물 다 바꾼다… 삼성E&A, 해수담수화 시장 메가 수주...",https://www.pinpointnews.co.kr/news/articleView.html?idxno=459628,수처리 및 환경 플랜트 분야에서는 삼성E&A와 두산에너빌리티가 시장을 이끌고 있다. 삼성E&A는 해수담수화와 산업용 수처리 사업 경쟁력을 갖추고 있으며 두산에너빌리티는 발전설비와 함께 물 관련 인프라 사업 역량을... 
삼성E&A,2026-06-10,[헬로스톡] 6/10 주목할 종목 : 현대건설·삼성E&A·NH투자증권·하나마...,https://www.hellot.net/news/article.html?no=113122,"삼성E&A — 사우디·UAE 가스 투자 확대, EPC 수혜 최전선 삼성E&A(028050)는 이번 테크포럼 탐방을 통해 중동 지역에서의 가스 수주 확대 가능성을 확인했다. EPC(설계·조달·시공)란 대형 플랜트 건설 전 과정을... "
삼성E&A,2026-06-09,"[발로 뛰는 건설사 CEO] 세계로 세계로…삼성E&A 남궁홍, 포트폴리오 확...",https://www.shinailbo.co.kr/news/articleView.html?idxno=5027918, 남궁홍 삼성E&A 대표는 변화와 도전 속 수익성 창출이라는 성과를 내고 있다. 취임 이후 줄곧 흑자 기조를 유지하면서 8~9%대 영업이익률을 내며 높은 마진율을 기록 중이다. 2024년 시대 변화를 선도하는... 
삼성E&A,2026-06-09,"삼성E&A, 반도체·중동 재건 '쌍끌이' 성장 기대",https://www.newsway.co.kr/news/view?ud=2026060916024522939,삼성E&A가 삼성전자의 대규모 반도체 투자 확대에 힘입어 첨단산업 수주를 빠르게 늘리고 있다. 중동 화공 플랜트 발주 지연 우려에도 그룹사 물량 증가와 재건 수요를 앞세워 성장 동력을 확보하는 모습이다. 8일... 
삼성E&A,2026-06-08,"삼성E&A, LNG·CCS 성장 모멘텀 부각…""중장기 수주 기회 확대""",http://www.biztribune.co.kr/news/articleView.html?idxno=354469,"출처=하나증권 삼성E&A가 액화천연가스(LNG) 플랜트와 탄소포집·저장(CCS) 사업을 중심으로 중장기 성장 동력을 확보할 것이라는 전망이 나왔다 하나증권은 4일 삼성E&A에 대해 ""중동 지정학적 리스크 확대에도... "
삼성E&A,2026-06-05,"가스안전공사, 삼성E&A ‘테크 포럼’서 자체개발 검사로봇·RBI 솔루션...",https://www.g-enews.com/view.php?ud=202606051056179229a9fc143920_1,"가스안전공사는 지난 2일 삼성E&A가 개최한 ‘SAMSUNG E&A Tech Forum 2026’에 참가해, 국내외 산업 플랜트의 근원적 안전성 향상과 최신 가스안전 기술 생태계 공유를 위한 홍보부스를 운영했다. 이번 포럼은 민간과 공공의... "
대우건설,2026-06-12,[건설 라운지] 대우건설·SK에코플랜트·GS건설·현대건설...해외 수주·...,http://www.kdfnews.com/news/articleView.html?idxno=184156,대우건설이 시공한 인도라마 비료 플랜트 3호기 현장 전경. 대우건설은 나이지리아에서 수행한 '인도라마 비료 플랜트 3호기' 공사를 예정 일정에 맞춰 성공적으로 준공했다고 12일 밝혔다. 이번 프로젝트는 하루 2300톤... 
대우건설,2026-06-10,상도15구역 품는 대우건설…연간 수주 목표액 달성 ‘청신호’,https://news.mtn.co.kr/news-detail/2026060915585823375,상도15구역 조감도./사진=서울시대우건설이 서울 동작구 상도15구역 재개발 사업 시공권 확보를 눈앞에 두면서 올해 도시정비사업 수주 목표액 5조원 달성에 한층 가까워졌다. 최근 1차 현장설명회를 진행한... 
대우건설,2026-06-08,"상반기에만 수주액 3조 대우건설, 하반기 로드맵은",http://www.wikileaks-kr.org/news/articleView.html?idxno=188269,"대우건설의 도시정비 수주액은 2022년 5조2759억원을 기록한 후 2023년 1조6858억원으로 급감했으나, 2024년 2조9823억원, 지난해 3조7727억원을 기록하며 완연한 회복세를 보이고 있다. 이러한 회복세에도 불구하고... "
대우건설,2026-06-08,"대우건설, 중랑천서 생태복원 활동…임직원 100여명 참여",https://www.news1.kr/realestate/general/6190284,"행사에는 김보현 대우건설 대표이사와 고광현 성동구 부구청장, 사회적협동조합 한강 관계자들이 참석해 기념식수 활동을 진행했다. 참석자들은 중랑천 일대에 단풍나무를 심으며 환경보전의 중요성을 되새기고, 민관... "
대우건설,2026-06-05,"[드림&CEO] 대우건설 정원주 회장, 국내 넘어 '제2 세계경영' 뱃고동",http://www.newsdream.kr/news/articleView.html?idxno=112471,"최근 대우건설의 해외 수주액은 전년 대비 비약적인 상승세를 기록했습니다. 특히 2026년 1분기 영업이익과 당기순이익이 각각 68.9%, 237.6% 증가하며 시장 전망치를 크게 상회하는 등 내실 있는 성장을 거뒀습니다. 특히 최근... "
대우건설,2026-06-05,"성수4지구 조합 ""행정 지도 요청 사실이면 대우건설에 강경 대응""",https://realty.chosun.com/site/data/html_dir/2026/06/05/2026060503028.html,☞관련 기사: 성수4지구 수주전 막장 파행 어디까지…'날인 거부' 대우-조합 갈등 폭발 조합은 5일 “대우건설이 성동구청과 서울시에 조합에 대한 행정 지도를 요청한 것이 사실이라면 이는 입찰 참여규정 상 발주자의... 
대우건설,2026-06-05,"대우건설, 장위뉴타운 10구역 '장위 푸르지오 마크원' 공급",https://www.thepublic.kr/news/articleView.html?idxno=306527,"대우건설이 이달 서울 성북구 장위동 일원에 조성되는 '장위 푸르지오 마크원'의 분양에 나선다. 장위뉴타운 10구역 재개발 사업을 통해 공급되는 단지로, 총 1931세대 규모 가운데 1032세대가 일반분양 물량으로 공급될... "
GS건설,2026-06-12,[건설레이더] SK에코플랜트·대우건설·GS건설 주요 업데이트,http://www.finomy.com/news/articleView.html?idxno=255618,◆ 목동 재건축 기대감 고조…GS건설 '목동윤슬자이' 7월 분양 예정 목동신시가지 재건축이 속도를 내면서 일대 아파트 가격 재평가도 빨라지고 있다. 목동신시가지 2단지 전용 144㎡는 지난해 2월 29억8000만원에서... 
GS건설,2026-06-12,"GS건설·우미건설, 경기도 신규 단지 분양 추진",http://www.wsobi.com/news/articleView.html?idxno=313613,GS건설과 우미건설이 경기도에서 신규 단지 분양에 나선다. GS건설은 오산시에서 '북오산자이 드포레'를 분양하며 우미건설 컨소시엄은 평택시에서 '평택 고덕 우미린 프레스티지' 청약에 돌입한다. GS건설이... 
GS건설,2026-06-11,"[산업 HOT 뉴스] GS건설, 대동로보틱스와 건설현장 로봇 기술 개발위해...",http://www.bizwnews.com/news/articleView.html?idxno=138409,지난 5일 서울 서초동 GS건설 R&D센터에서 열린 'AI 필드로봇 활용 건설현장 자동화를 위한 연구개발 협력' 업무협약 체결식에서 GS건설 조성한 미래기술원장(왼쪽)과 대동로보틱스 강성철 대표이사가 기념촬영을 하고... 
GS건설,2026-06-10,"GS건설 자이, 준공 후 단지 '먼저보고 새로고침' 나선다",http://www.popcornnews.net/news/articleView.html?idxno=123502,GS건설 자이(Xi)가 입주민 주거 만족도 극대화를 위해 선제적 사후관리(AS) 캠페인 '먼저보고 새로고침'을 고도화해 시행한다고 10일 밝혔다. '먼저보고 새로고침'은 입주민 하자 접수 이후 보수를 진행하던 기존의 수동적... 
GS건설,2026-06-10,"GS건설, 입주 후 관리부터 신규 공급까지… 자이 차별화 전략 강화",http://www.whitepaper.co.kr/news/articleView.html?idxno=263392,(사진=GS건설)  GS건설이 입주 단지 품질관리 강화와 신규 분양사업을 동시에 추진하며 자이(Xi) 브랜드 경쟁력 제고에 나섰다. 입주 후 선제 점검 서비스를 확대하는 한편 충남 천안에서는 1000가구가 넘는 대단지... 
GS건설,2026-06-09,"상반기 도시정비 수주고, 현대건설·GS건설 ‘양강 체제’… 삼성물산 ...",https://www.theguru.co.kr/news/article.html?no=102821,"8조원 돌파 GS건설 7.5조원 육박... 목표 조기 달성 목전 삼성물산, 목표치 '13조원' 상향하며 3위 안착 중위권 순위, 목동6·성수4지구 총회 결과로 재편 [더구루=김수현 기자] 올해 도시정비사업 시장 규모가 약 80조... "
GS건설,2026-06-08,"GS건설, '피지컬 인공지능'으로 스마트 건설 혁신 박차",https://www.tokenpost.kr/news/tech/366947,"GS건설이 인공지능 기반 자율주행 로봇을 건설 현장에 도입하는 협력에 나서면서, 건설업의 자동화와 스마트... 이 같은 흐름은 앞으로 대형 건설사를 중심으로 실증 사업이 확대되면서, 건설 장비와 인공지능 기술이... "
GS건설,2026-06-07,"[ESG경영 사례분석] GS건설, 허윤홍의 '지속가능한 글로벌 기업' 비전으...",https://www.news2day.co.kr/article/20260604500186,이번 협력은 GS건설의 플랜트 설계·조달·시공(EPC) 역량과 아모지의 암모니아 기반 수소 전환 기술을 결합해 새로운 무탄소 전력 생산 모델을 구축하기 위해 추진됐다. 화석연료 발전을 대체할 차세대 에너지원을... 
GS건설,2026-06-05,"8조 수주 향하는 GS건설, 사업 다각화 속도 낸다",http://www.lkp.news/news/articleView.html?idxno=80680,"◆ 정비사업 수주 질주, 연간 목표 달성 가시권 GS건설은 최근 수지삼성4차 재건축과 금정4구역 재개발 사업 시공권을 확보했다. 두 사업 공사비는 총 8425억원 규모다. 여기에 성남 상대원2구역 재개발 사업까지 시공사로... "
DL이앤씨,2026-06-11,"“제주 청정수소 발전 전환 추진”…동서발전, DL이앤씨와 제주 복합발...",https://www.mk.co.kr/article/12072129,150MW 친환경 가스복합발전수 조성 추진 한국동서발전이 DL이앤씨와 제주 복합발전소 건설계약을 체결했다. 동서발전은 11일 오후 2시 울산 중구 본사에서 DL이앤씨와 약 5500억 원 규모의‘제주 복합발전소 파워블럭 및... 
DL이앤씨,2026-06-10,"'수주 제로' DL이앤씨·IPARK현산, '1.8조' 성수2지구서 반전 노린다",https://www.theguru.co.kr/news/article.html?no=102867,이달 말 시공자 선정 재공고…11월 총회 개최 예상 '아크로' 앞세운 DL이앤씨 유력 속 IPARK현산 가세 현대건설 불참 기류... 삼성물산·포스코이앤씨 검토 [더구루=김수현 기자] 올해 도시정비사업 수주를 올리지 못한... 
DL이앤씨,2026-06-10,"2조원대 현금부자 DL이앤씨, 필리핀 MCRP 프로젝트 순항…이익금 회수로...",https://www.asiatoday.co.kr/kn/view.php?key=20260609010003109,"“JV 이익금 회수는 통상 절차” 부채비율 87%로 업계 최저 수준 동남아 에너지 투자확대, 현지 입지↑ DL이앤씨가 필리핀 말로로스~클라크 철도 프로젝트에서 발생한 이익금을 본사로 회수했다. 수조원대 현금성... "
DL이앤씨,2026-06-09,"DL이앤씨, 상반기 플랜트 수주 1조원 돌파…플랜트·에너지 성장축",https://www.greened.kr/news/articleView.html?idxno=342113,"▲ DL이앤씨 사옥 (DL이앤씨 제공) DL이앤씨가 플랜트와 에너지 인프라를 새로운 성장축으로 키우고 있다. 정비사업 경쟁력을 유지하면서도 발전소와 철도, 차세대 원전 등 비주택 분야 수주를 확대하며 사업... "
DL이앤씨,2026-06-08,"목동 재건축 수주 첫 주자는 DL이앤씨, 6단지 유력",https://www.arunews.com/news/articleView.html?idxno=63421,"조합이 DL이앤씨를 우선협상대상자로 지정하면서 일대 재건축 14개 단지 가운데 처음으로 시공자 선정이 구체화되고 있는 것이다. 목동 재건축 시공권 확보의 출발점으로, 후속 단지들의 움직임에도 관심이 쏠리고 있다.... "
